Course_Index,Course_Title,Course_Units,Course_Description,Course_Prerequisites,Major_Restriction,Course_Tags
MATH 146,Analysis of Ordinary Differential Equations,4.0,"A rigorous introduction to systems of ordinary differential equations. Topics include linear systems, matrix diagonalization and canonical forms, matrix exponentials, nonlinear systems, existence and uniqueness of solutions, linearization, and stability. Prerequisites: MATH 140B or MATH 142B. Students who have not completed listed prerequisite(s) may enroll with the consent of instructor.","[['MATH 140B', 'MATH 142B']]",[],[]
MATH 148,Analysis of Partial Differential Equations,4.0,"A rigorous introduction to partial differential equations. Topics include initial and boundary value problems; first order linear and quasilinear equations, method of characteristics; wave and heat equations on the line, half-line, and in space; separation of variables for heat and wave equations on an interval and for Laplace’s equation on rectangles and discs; eigenfunctions of the Laplacian and heat, wave, Poisson’s equations on bounded domains; and Green’s functions and distributions. Prerequisites: MATH 140B or MATH 142B. Students who have not completed listed prerequisite(s) may enroll with the consent of instructor.","[['MATH 140B', 'MATH 142B']]",[],[]
MATH 150A,Differential Geometry,4.0,"Differential geometry of curves and surfaces. Gauss and mean curvatures, geodesics, parallel displacement, Gauss-Bonnet theorem. Prerequisites: MATH 20E or MATH 31CH and either MATH 18 or MATH 20F or MATH 31AH. Students who have not completed listed prerequisites may enroll with consent of instructor.","[['MATH 20E', 'MATH 31CH'], ['MATH 18', 'MATH 20F', 'MATH 31AH']]",[],[]
MATH 150B,Calculus on Manifolds,4.0,"Calculus of functions of several variables, inverse function theorem. Further topics may include exterior differential forms, Stokes’ theorem, manifolds, Sard’s theorem, elements of differential topology, singularities of maps, catastrophes, further topics in differential geometry, topics in geometry of physics. Prerequisites: MATH 150A or consent of instructor.",[['MATH 150A']],[],[]
MATH 152,Applicable Mathematics and Computing,4.0,"This course will give students experience in applying theory to real world applications such as internet and wireless communication problems. The course will incorporate talks by experts from industry and students will be helped to carry out independent projects. Topics include graph visualization, labelling, and embeddings, random graphs and randomized algorithms. May be taken for credit three times. Prerequisites: MATH 20D and either MATH 18 or MATH 20F or MATH 31AH. Students who have not completed listed prerequisites may enroll with consent of instructor.","[['MATH 20D'], ['MATH 18', 'MATH 20F', 'MATH 31AH']]",[],[]
MATH 153,Geometry for Secondary Teachers,4.0,"Two- and three-dimensional Euclidean geometry is developed from one set of axioms. Pedagogical issues will emerge from the mathematics and be addressed using current research in teaching and learning geometry. This course is designed for prospective secondary school mathematics teachers. Prerequisites: MATH 109 or MATH 31CH, or consent of instructor.","[['MATH 109', 'MATH 31CH']]",[],[]
MATH 154,Discrete Mathematics and Graph Theory,4.0,"Basic concepts in graph theory, including trees, walks, paths, and connectivity, cycles, matching theory, vertex and edge-coloring, planar graphs, flows and combinatorial algorithms, covering Hall’s theorems, the max-flow min-cut theorem, Euler’s formula, and the travelling salesman problem. Credit not offered for MATH 154 if MATH 158 is previously taken. If MATH 154 and MATH 158 are concurrently taken, credit is only offered for MATH 158. Prerequisites: MATH 31CH or MATH 109. Students who have not completed listed prerequisites may enroll with consent of instructor.","[['MATH 31CH', 'MATH 109']]",[],[]
MATH 155A,Geometric Computer Graphics,4.0,"Bezier curves and control lines, de Casteljau construction for subdivision, elevation of degree, control points of Hermite curves, barycentric coordinates, rational curves. Programming knowledge recommended. (Students may not receive credit for both MATH 155A and CSE 167 or CSE 167R.) Prerequisites: MATH 18 or MATH 20F or MATH 31AH, and MATH 20C. Students who have not completed listed prerequisites may enroll with consent of instructor.","[['MATH 18', 'MATH 20F', 'MATH 31AH'], ['MATH 20C']]",[],[]
MATH 155B,Topics in Computer Graphics,4.0,"Spline curves, NURBS, knot insertion, spline interpolation, illumination models, radiosity, and ray tracing. Prerequisites: MATH 155A. Students who have not completed listed prerequisites may enroll with consent of instructor.",[['MATH 155A']],[],[]
MATH 157,Introduction to Mathematical Software,4.0,"This course provides a hands-on introduction to the use of a variety of open-source mathematical software packages, as applied to a diverse range of topics within pure and applied mathematics. Most of these packages are built on the Python programming language, but experience with another common programming language is acceptable. All software will be accessed using the CoCalc web platform (http://cocalc.com), which provides a uniform interface through any web browser. Students will need to bring a laptop or tablet to lectures in order to participate in interactive presentations. Students should have exposure to one of the following programming languages: C, C++, Java, Python, R. Prerequisites: MATH 18 or MATH 20F or MATH 31AH and one of BILD 62, COGS 18 or CSE 5A or CSE 6R or CSE 8A or CSE 11 or DSC 10 or ECE 15 or ECE 143 or MATH 189. Students who have not completed listed prerequisites may enroll with consent of instructor.","[['MATH 18', 'MATH 20F', 'MATH 31AH'], ['COGS 18', 'CSE 5A', 'CSE 6R', 'CSE 8A', 'CSE 11', 'DSC 10', 'ECE 15', 'ECE 143', 'MATH 189']]",[],[]
MATH 158,Extremal Combinatorics and Graph Theory,4.0,"Extremal combinatorics is the study of how large or small a finite set can be under combinatorial restrictions. We will give an introduction to graph theory, connectivity, coloring, factors, and matchings, extremal graph theory, Ramsey theory, extremal set theory, and an introduction to probabilistic combinatorics. Topics include Turan’s theorem, Ramsey’s theorem, Dilworth’s theorem, and Sperner’s theorem. Credit not offered for MATH 158 if MATH 154 was previously taken. If MATH 154 and MATH 158 are concurrently taken, credit is only offered for MATH 158. A strong performance in MATH 109 or MATH 31CH is recommended. Prerequisites: MATH 31CH or MATH 109. Students who have not completed the listed prerequisites may enroll with consent of instructor.","[['MATH 31CH', 'MATH 109']]",[],[]
MATH 160A,Elementary Mathematical Logic I,4.0,"An introduction to recursion theory, set theory, proof theory, model theory. Turing machines. Undecidability of arithmetic and predicate logic. Proof by induction and definition by recursion. Cardinal and ordinal numbers. Completeness and compactness theorems for propositional and predicate calculi. Prerequisites: MATH 100A, or MATH 103A, or MATH 140A, or consent of instructor.","[['MATH 100A', 'MATH 103A', 'MATH 140A']]",[],[]
MATH 160B,Elementary Mathematical Logic II,4.0,"A continuation of recursion theory, set theory, proof theory, model theory. Turing machines. Undecidability of arithmetic and predicate logic. Proof by induction and definition by recursion. Cardinal and ordinal numbers. Completeness and compactness theorems for propositional and predicate calculi. Prerequisites: MATH 160A or consent of instructor.",[['MATH 160A']],[],[]
MATH 163,History of Mathematics,4.0,"Topics will vary from year to year in areas of mathematics and their development. Topics may include the evolution of mathematics from the Babylonian period to the eighteenth century using original sources, a history of the foundations of mathematics and the development of modern mathematics. Prerequisites: MATH 20B or consent of instructor.",[['MATH 20B']],[],[]
MATH 168A,Topics in Applied Mathematics—Computer Science,4.0,"Topics to be chosen in areas of applied mathematics and mathematical aspects of computer science. May be taken for credit two times with different topics. Prerequisites: MATH 18 or MATH 20F or MATH 31AH, and MATH 20C. Students who have not completed listed prerequisites may enroll with consent of instructor.","[['MATH 18', 'MATH 20F', 'MATH 31AH'], ['MATH 20C']]",[],[]
MATH 170A,Introduction to Numerical Analysis: Linear Algebra,4.0,"This course covers analysis of numerical methods for linear algebraic systems and least squares problems. Topics include orthogonalization methods. Ill conditioned problems. Eigenvalue and singular value computations. Knowledge of programming recommended. Prerequisites: MATH 18 or MATH 31AH, and MATH 20C or MATH 31BH and CSE 20 or MATH 15A or MATH 31CH or MATH 109. Students who have not completed the listed prerequisites may enroll with consent of instructor.","[['MATH 18', 'MATH 31AH'], ['MATH 20C', 'MATH 31BH'], ['CSE 20', 'MATH 15A', 'MATH 31CH', 'MATH 109']]",[],[]
MATH 170B,Introduction to Numerical Analysis: Approximation and Nonlinear Equations,4.0,Rounding and discretization errors. Calculation of roots of polynomials and nonlinear equations. Interpolation. Approximation of functions. Knowledge of programming recommended. Prerequisites: MATH 170A.,[['MATH 170A']],[],[]
MATH 170C,Introduction to Numerical Analysis: Ordinary Differential Equations,4.0,"Numerical differentiation and integration. Ordinary differential equations and their numerical solution. Basic existence and stability theory. Difference equations. Boundary value problems. Prerequisites: MATH 20D or 21D and MATH 170B, or consent of instructor.","[['MATH 20D'], ['MATH 170B']]",[],[]
MATH 171A,Introduction to Numerical Optimization: Linear Programming,4.0,"Linear optimization and applications. Linear programming, the simplex method, duality. Selected topics from integer programming, network flows, transportation problems, inventory problems, and other applications. Three lectures, one recitation. Knowledge of programming recommended. (Credit not allowed for both MATH 171A and ECON 172A.) Prerequisites: MATH 18 or MATH 20F or MATH 31AH, and MATH 20C. Students who have not completed listed prerequisites may enroll with consent of instructor.","[['MATH 18', 'MATH 20F', 'MATH 31AH'], ['MATH 20C']]",[],[]
MATH 171B,Introduction to Numerical Optimization: Nonlinear Programming,4.0,"Convergence of sequences in Rn, multivariate Taylor series. Bisection and related methods for nonlinear equations in one variable. Newton’s methods for nonlinear equations in one and many variables. Unconstrained optimization and Newton’s method. Equality-constrained optimization, Kuhn-Tucker theorem. Inequality-constrained optimization. Three lectures, one recitation. Knowledge of programming recommended. (Credit not allowed for both MATH 171B and ECON 172B.) Prerequisites: MATH 20C or MATH 31BH and MATH 171A or consent of instructor.","[['MATH 20C', 'MATH 31BH'], ['MATH 171A']]",[],[]
MATH 173A,Optimization Methods for Data Science I,4.0,"Introduction to convexity: convex sets, convex functions; geometry of hyperplanes; support functions for convex sets; hyperplanes and support vector machines. Linear and quadratic programming: optimality conditions; duality; primal and dual forms of linear support vector machines; active-set methods; interior methods. Prerequisites: MATH 20C or MATH 31BH and MATH 18 or 20F or 31AH. Students who have not completed listed prerequisites may enroll with consent of instructor.","[['MATH 20C', 'MATH 31BH'], ['MATH 18']]",[],[]
MATH 173B,Optimization Methods for Data Science II,4.0,Unconstrained optimization: linear least squares; randomized linear least squares; method(s) of steepest descent; line-search methods; conjugate-gradient method; comparing the efficiency of methods; randomized/stochastic methods; nonlinear least squares; norm minimization methods. Convex constrained optimization: optimality conditions; convex programming; Lagrangian relaxation; the method of multipliers; the alternating direction method of multipliers; minimizing combinations of norms. Prerequisites: MATH 173A. Students who have not completed listed prerequisites may enroll with consent of instructor.,[['MATH 173A']],[],[]
MATH 174,Numerical Methods for Physical Modeling,4.0,"(Conjoined with MATH 274.) Floating point arithmetic, direct and iterative solution of linear equations, iterative solution of nonlinear equations, optimization, approximation theory, interpolation, quadrature, numerical methods for initial and boundary value problems in ordinary differential equations. (Students may not receive credit for both MATH 174 and PHYS 105, AMES 153 or 154. Students may not receive credit for MATH 174 if MATH 170A, B, or C has already been taken.) Graduate students will do an extra assignment/exam. Prerequisites: Math 20D or MATH 21D, and either MATH 20F or MATH 31AH, or consent of instructor.","[['Math 20D', 'MATH 21D'], ['MATH 20F', 'MATH 31AH']]",[],[]
MATH 175,Numerical Methods for Partial Differential Equations,4.0,"(Conjoined with MATH 275.) Mathematical background for working with partial differential equations. Survey of finite difference, finite element, and other numerical methods for the solution of elliptic, parabolic, and hyperbolic partial differential equations. (Formerly MATH 172. Students may not receive credit for MATH 175/275 and MATH 172.) Graduate students do an extra paper, project, or presentation, per instructor. Prerequisites: MATH 174 or MATH 274, or consent of instructor.","[['MATH 174', 'MATH 274']]",[],[]
MATH 179,Projects in Computational and Applied Mathematics,4.0,"(Conjoined with MATH 279.) Mathematical models of physical systems arising in science and engineering, good models and well-posedness, numerical and other approximation techniques, solution algorithms for linear and nonlinear approximation problems, scientific visualizations, scientific software design and engineering, project-oriented. Graduate students will do an extra paper, project, or presentation per instructor. Prerequisites: MATH 174 or MATH 274 or consent of instructor.","[['MATH 174', 'MATH 274']]",[],[]
MATH 180A,Introduction to Probability,4.0,"Probability spaces, random variables, independence, conditional probability, distribution, expectation, variance, joint distributions, central limit theorem. (Two units of credit offered for MATH 180A if ECON 120A previously, no credit offered if ECON 120A concurrently. Two units of credit offered for MATH 180A if MATH 183 or 186 taken previously or concurrently.) Prior or concurrent enrollment in MATH 109 is highly recommended. Prerequisites: MATH 20C or MATH 31BH, or consent of instructor.","[['MATH 20C', 'MATH 31BH']]",[],[]
MATH 180B,Introduction to Stochastic Processes I,4.0,"Random vectors, multivariate densities, covariance matrix, multivariate normal distribution. Random walk, Poisson process. Other topics if time permits. Prerequisites: MATH 20D and either MATH 18 or MATH 20F or MATH 31AH, and MATH 109 or MATH 31CH, and MATH 180A. Students who have not completed listed prerequisites may enroll with consent of instructor.","[['MATH 20D'], ['MATH 18', 'MATH 20F', 'MATH 31AH'], ['MATH 109', 'MATH 31CH'], ['MATH 180A']]",[],[]
MATH 180C,Introduction to Stochastic Processes II,4.0,"Markov chains in discrete and continuous time, random walk, recurrent events. If time permits, topics chosen from stationary normal processes, branching processes, queuing theory. Prerequisites: MATH 180B or consent of instructor.",[['MATH 180B']],[],[]
MATH 181A,Introduction to Mathematical Statistics I,4.0,"Multivariate distribution, functions of random variables, distributions related to normal. Parameter estimation, method of moments, maximum likelihood. Estimator accuracy and confidence intervals. Hypothesis testing, type I and type II errors, power, one-sample t-test. Prior or concurrent enrollment in MATH 109 is highly recommended. Prerequisites: MATH 180A, and MATH 18 or MATH 20F or MATH 31AH, and MATH 20C. Students who have not completed listed prerequisites may enroll with consent of instructor.","[['MATH 180A'], ['MATH 18', 'MATH 20F', 'MATH 31AH'], ['MATH 20C']]",[],[]
MATH 181B,Introduction to Mathematical Statistics II,4.0,"Hypothesis testing. Linear models, regression, and analysis of variance. Goodness of fit tests. Nonparametric statistics. Two units of credit offered for MATH 181B if ECON 120B previously; no credit offered if ECON 120B concurrently. Prior enrollment in MATH 109 is highly recommended. Prerequisites: MATH 181A or consent of instructor.",[['MATH 181A']],[],[]
MATH 181C,Mathematical Statistics—Nonparametric Statistics,4.0,"Topics covered may include the following: classical rank test, rank correlations, permutation tests, distribution free testing, efficiency, confidence intervals, nonparametric regression and density estimation, resampling techniques (bootstrap, jackknife, etc.) and cross validations. Prior enrollment in MATH 109 is highly recommended. Prerequisites: MATH 181B or consent of instructor.",[['MATH 181B']],[],[]
MATH 181D,Statistical Learning,4.0,"Statistical learning refers to a set of tools for modeling and understanding complex data sets. It uses developments in optimization, computer science, and in particular machine learning. This encompasses many methods such as dimensionality reduction, sparse representations, variable selection, classification, boosting, bagging, support vector machines, and machine learning. Prerequisites: ECE 109 or ECON 120A or MAE 108 or MATH 181A or MATH 183 or MATH 186 or MATH 189. Students who have not completed listed prerequisites may enroll with consent of instructor.","[['ECE 109', 'ECON 120A', 'MAE 108', 'MATH 181A', 'MATH 183', 'MATH 186', 'MATH 189']]",[],[]
MATH 181E,Mathematical Statistics—Time Series,4.0,"Analysis of trends and seasonal effects, autoregressive and moving averages models, forecasting, informal introduction to spectral analysis. Prerequisites: MATH 181B or consent of instructor.",[['MATH 181B']],[],[]
MATH 181F,Sampling Surveys and Experimental Design,4.0,"Design of sampling surveys: simple, stratified, systematic, cluster, network surveys. Sources of bias in surveys. Estimators and confidence intervals based on unequal probability sampling. Design and analysis of experiments: block, factorial, crossover, matched-pairs designs. Analysis of variance, re-randomization, and multiple comparisons. Prerequisites: ECE 109 or ECON 120A or MAE 108 or MATH 11 or MATH 181A or MATH 183 or MATH 186 or MATH 189. Students who have not completed listed prerequisites may enroll with consent of instructor.","[['ECE 109', 'ECON 120A', 'MAE 108', 'MATH 11', 'MATH 181A', 'MATH 183', 'MATH 186', 'MATH 189']]",[],[]
MATH 182,Hidden Data in Random Matrices,4.0,"Rigorous treatment of principal component analysis, one of the most effective methods in finding signals amidst the noise of large data arrays. Topics include singular value decomposition for matrices, maximal likelihood estimation, least squares methods, unbiased estimators, random matrices, Wigner’s semicircle law, Markchenko-Pastur laws, universality of eigenvalue statistics, outliers, the BBP transition, applications to community detection, and stochastic block model. Students will not receive credit for both MATH 182 and DSC 155. Completion of MATH 102 is encouraged but not required. Prerequisites: MATH 180A, and MATH 18 or MATH 31AH. Students who have not completed listed prerequisites may enroll with consent of instructor.","[['MATH 180A'], ['MATH 18', 'MATH 31AH']]",[],[]
MATH 183,Statistical Methods,4.0,"Introduction to probability. Discrete and continuous random variables–binomial, Poisson and Gaussian distributions. Central limit theorem. Data analysis and inferential statistics: graphical techniques, confidence intervals, hypothesis tests, curve fitting. (Credit not offered for MATH 183 if ECON 120A, ECE 109, MAE 108, MATH 181A, or MATH 186 previously or concurrently taken. Two units of credit offered for MATH 183 if MATH 180A taken previously or concurrently.) Prerequisites: MATH 20C or MATH 31BH, or consent of instructor.","[['MATH 20C', 'MATH 31BH']]",[],[]
MATH 184,Enumerative Combinatorics,4.0,"Introduction to the theory and applications of combinatorics. Enumeration of combinatorial structures (permutations, integer partitions, set partitions). Bijections, inclusion-exclusion, ordinary and exponential generating functions. Renumbered from MATH 184A; credit not offered for MATH 184 if MATH 184A if previously taken. Credit not offered for MATH 184 if MATH 188 previously taken. If MATH 184 and MATH 188 are concurrently taken, credit only offered for MATH 188. Prerequisites: MATH 31CH or MATH 109. Students who have not completed listed prerequisites may enroll with consent of instructor.","[['MATH 31CH', 'MATH 109']]",[],[]
MATH 185,Introduction to Computational Statistics,4.0,"Statistical analysis of data by means of package programs. Regression, analysis of variance, discriminant analysis, principal components, Monte Carlo simulation, and graphical methods. Emphasis will be on understanding the connections between statistical theory, numerical results, and analysis of real data. Recommended preparation: exposure to computer programming (such as CSE 5A, CSE 7, or ECE 15) highly recommended. Prerequisites: MATH 181A, or ECON 120B, and either MATH 18 or MATH 20F or MATH 31AH, and MATH 20C or MATH 31BH. Students who have not completed listed prerequisites may enroll with consent of instructor.","[['MATH 181A', 'ECON 120B'], ['MATH 18', 'MATH 20F', 'MATH 31AH'], ['MATH 20C', 'MATH 31BH']]",[],[]
MATH 186,Probability and Statistics for Bioinformatics,4.0,"This course will cover discrete and random variables, data analysis and inferential statistics, likelihood estimators and scoring matrices with applications to biological problems. Introduction to Binomial, Poisson, and Gaussian distributions, central limit theorem, applications to sequence and functional analysis of genomes and genetic epidemiology. (Credit not offered for MATH 186 if ECON 120A, ECE 109, MAE 108, MATH 181A, or MATH 183 previously or concurrently. Two units of credit offered for MATH 186 if MATH 180A taken previously or concurrently.) Prerequisites: MATH 20C or MATH 31BH, or consent of instructor.","[['MATH 20C', 'MATH 31BH']]",[],[]
MATH 187A,Introduction to Cryptography,4.0,An introduction to the basic concepts and techniques of modern cryptography. Classical cryptanalysis. Probabilistic models of plaintext. Monoalphabetic and polyalphabetic substitution. The one-time system. Caesar-Vigenere-Playfair-Hill substitutions. The Enigma. Modern-day developments. The Data Encryption Standard. Public key systems. Security aspects of computer networks. Data protection. Electronic mail. Recommended preparation: basic programming experience. Renumbered from MATH 187. Students may not receive credit for both MATH 187A and MATH 187. Prerequisites: MATH 10A or MATH 20A. Students who have not completed listed prerequisite may enroll with consent of instructor.,"[['MATH 10A', 'MATH 20A']]",[],[]
MATH 187B,Mathematics of Modern Cryptography,4.0,"The object of this course is to study modern public key cryptographic systems and cryptanalysis (e.g., RSA, Diffie-Hellman, elliptic curve cryptography, lattice-based cryptography, homomorphic encryption) and the mathematics behind them. We also explore other applications of these computational techniques (e.g., integer factorization and attacks on RSA). Recommended preparation: Familiarity with Python and/or mathematical software (especially SAGE) would be helpful, but it is not required. Prerequisites: MATH 187 or MATH 187A and MATH 18 or MATH 31AH or MATH 20F. Students who have not completed listed prerequisites may enroll with consent of instructor.","[['MATH 187', 'MATH 187A'], ['MATH 18', 'MATH 31AH', 'MATH 20F']]",[],[]
MATH 188,Algebraic Combinatorics,4.0,"A rigorous introduction to algebraic combinatorics. Basic enumeration and generating functions. Enumeration involving group actions: Polya theory. Posets and Sperner property. q-analogs and unimodality. Partitions and tableaux. Credit not offered for MATH 188 if MATH 184 or MATH 184A previously taken. If MATH 184 and MATH 188 are concurrently taken, credit only offered for MATH 188. Prerequisites: MATH 31CH or MATH 109 and MATH 18 or MATH 31AH and MATH 100A or 103A. Students who have not completed listed prerequisites may enroll with consent of instructor.","[['MATH 31CH', 'MATH 109'], ['MATH 18', 'MATH 31AH'], ['MATH 100A']]",[],[]
MATH 189,Exploratory Data Analysis and Inference,4.0,"An introduction to various quantitative methods and statistical techniques for analyzing data—in particular big data. Quick review of probability continuing to topics of how to process, analyze, and visualize data using statistical language R. Further topics include basic inference, sampling, hypothesis testing, bootstrap methods, and regression and diagnostics. Offers conceptual explanation of techniques, along with opportunities to examine, implement, and practice them in real and simulated data. Prerequisites: MATH 18 or MATH 20F or MATH 31AH, and MATH 20C and one of BENG 134, CSE 103, ECE 109, ECON 120A, MAE 108, MATH 180A, MATH 183, MATH 186, or SE 125. Students who have not completed listed prerequisites may enroll with consent of instructor.","[['MATH 18', 'MATH 20F', 'MATH 31AH'], ['MATH 20C'], ['BENG 134', 'CSE 103', 'ECE 109', 'ECON 120A', 'MAE 108', 'MATH 180A', 'MATH 183', 'MATH 186', 'SE 125']]",[],[]
