Course_Index,Course_Title,Course_Units,Course_Description,Course_Prerequisites,Major_Restriction,Course_Tags
MATH 190A,Foundations of Topology I,4.0,"An introduction to point set topology: topological spaces, subspace topologies, product topologies, quotient topologies, continuous maps and homeomorphisms, metric spaces, connectedness, compactness, basic separation, and countability axioms. Examples. Instructor may choose further topics such as Urysohn’s lemma, Urysohn’s metrization theorem. Formerly MATH 190. Students may not receive credit for MATH 190A and MATH 190. Prerequisites: MATH 31CH or MATH 140A or MATH 142A. Students who have not completed prerequisites may enroll with consent of instructor.","[['MATH 31CH', 'MATH 140A', 'MATH 142A']]",[],[]
MATH 190B,Foundations of Topology II,4.0,"An introduction to the fundamental group: homotopy and path homotopy, homotopy equivalence, basic calculations of fundamental groups, fundamental group of the circle and applications (for instance to retractions and fixed-point theorems), van Kampen’s theorem, covering spaces, universal covers. Examples of all of the above. Instructor may choose further topics such as deck transformations and the Galois correspondence, basic homology, compact surfaces. Prerequisites: MATH 190A. Students who have not completed the listed prerequisite may enroll with consent of instructor.",[['MATH 190A']],[],[]
MATH 191,Topics in Topology,4.0,"Topics to be chosen by the instructor from the fields of differential algebraic, geometric, and general topology. Prerequisites: MATH 190A or consent of instructor.",[['MATH 190A']],[],[]
MATH 193A,Actuarial Mathematics I,4.0,"Probabilistic Foundations of Insurance. Short-term risk models. Survival distributions and life tables. Introduction to life insurance. Prerequisites: MATH 180A or MATH 183, or consent of instructor.","[['MATH 180A', 'MATH 183']]",[],[]
MATH 193B,Actuarial Mathematics II,4.0,Life Insurance and Annuities. Analysis of premiums and premium reserves. Introduction to multiple life functions and decrement models as time permits. Prerequisites: MATH 193A or consent of instructor.,[['MATH 193A']],[],[]
MATH 194,The Mathematics of Finance,4.0,"Introduction to the mathematics of financial models. Basic probabilistic models and associated mathematical machinery will be discussed, with emphasis on discrete time models. Concepts covered will include conditional expectation, martingales, optimal stopping, arbitrage pricing, hedging, European and American options. Prerequisites: MATH 20D, and either MATH 18 or MATH 20F or MATH 31AH, and MATH 180A. Students who have not completed listed prerequisites may enroll with consent of instructor. Students completing ECON 120A instead of MATH 180A must obtain consent of instructor to enroll.","[['MATH 20D'], ['MATH 18', 'MATH 20F', 'MATH 31AH'], ['MATH 180A']]",[],[]
MATH 195,Introduction to Teaching in Mathematics,4.0,Students will be responsible for and teach a class section of a lower-division mathematics course. They will also attend a weekly meeting on teaching methods. (Does not count toward a minor or major.) Prerequisites: consent of instructor.,[[]],[],[]
MATH 196,Student Colloquium,1.0,A variety of topics and current research results in mathematics will be presented by guest lecturers and students under faculty direction. May be taken for P/NP grade only. Prerequisites: upper-division status.,[[]],[],[]
MATH 197,Extracurricular Industry Practicum (2 or,,"An enrichment program which provides academic credit for work experience with public/private sector employers. After independently securing an internship with significant mathematical content, students will identify a faculty member to work with directly, discussing the mathematics involved. Faculty may require related readings and assignments as appropriate. May be taken for credit three times. Units may not be applied towards major graduation requirements. Prerequisites: permission of department.",[[]],[],[]
MATH 199,Independent Study for Undergraduates (2 or,,Independent reading in advanced mathematics by individual students. Three periods. (P/NP grades only.) Prerequisites: permission of department.,[[]],[],[]
MATH 199H,Honors Thesis Research for Undergraduates,,"Honors thesis research for seniors participating in the Honors Program. Research is conducted under the supervision of a mathematics faculty member. Prerequisites: admission to the Honors Program in mathematics, department stamp.",[[]],[],[]
